PRODUCT_ID,PRODUCT_NAME,CATEGORY_ID,SUBCATEGORY,BRAND,SUPPLIER_ID,UNIT_PRICE,UNIT_COST,WEIGHT_KG,IS_ACTIVE,LAUNCH_DATE,DISCONTINUE_DATE,SKU,DESCRIPTION
PRD-0FD09518534,UrbanEdge Self-enabling web-enabled installation,CAT-0012,,SwiftLine,SUP-967C73FF3E4,1858.05,1142.32,36.726,True,2022-05-05,,SKU-4E07CFB064F,Gun different energy arrive it that sister agree public us hospital paper term security camera past.
PRD-EEE9BC76430,SilverPeak Open-source secondary system engine,CAT-0026,,ZenCraft,SUP-6144293394B,8.59,4.99,48.263,False,2025-06-02,,SKU-EEE9CFDE411,Drop miss market avoid outside individual no relate since.
PRD-82898A329D5,UrbanEdge Balanced holistic focus group,CAT-0007,,IronBark,SUP-6BCE89892BD,1842.47,1265.8,7.118,True,2025-05-01,,SKU-53D01A699EF,Exactly practice would game student painting try talk like maintain serious style operation.
PRD-4D2ED2F8111,IronBark Synergized real-time policy,CAT-0006,,ZenCraft,SUP-E6661451775,1964.85,721.4,33.534,True,2024-04-14,,SKU-4783AC12A58,Case front reality window mouth pattern as pick various themselves organization direction unit food dream.
PRD-2D97EA87D36,VoltEdge Integrated content-based groupware,CAT-0005,,BlueHorizon,SUP-BC1A55BB0F4,27.73,10.64,39.372,True,2022-06-21,2025-12-04,SKU-76387FC5987,Put everything our prove could party skin soon read couple rather Republican need daughter leg.
PRD-4AB57E6FF6C,IronBark Decentralized uniform success,CAT-0027,,GreenLeaf,SUP-FF6C3B1149A,1466.51,1008.43,17.626,True,2024-02-02,,SKU-14A150A11C5,Police day so store consumer positive market early machine establish nothing.
PRD-EA5A1E77BA4,PureForm Digitized eco-centric portal,CAT-0015,,TechPulse,SUP-713BFCACB32,1578.52,838.54,3.778,True,2024-03-04,,SKU-AC52AE78CDB,Education whom spend worker about country various until.
PRD-A7BE1F9D7C2,EcoVibe Reactive optimal focus group,CAT-0022,,TechPulse,SUP-FF6C3B1149A,640.84,436.2,8.129,False,2023-10-08,,SKU-38C44D161BB,Note current anything into word other live hit budget Congress guess soon approach suggest everyone.
PRD-A7094395732,SilverPeak Future-proofed clear-thinking toolset,CAT-0031,,VoltEdge,SUP-E62A0DD4B90,1956.19,851.3,21.623,True,2024-03-24,,SKU-C1EA6C7454C,Understand rather daughter through note act front person.
PRD-DEDA86963B9,BlueHorizon Optional disintermediate emulation,CAT-0014,,UrbanEdge,SUP-F86F0A9088F,871.23,280.03,34.89,True,2022-11-23,,SKU-5B4B5732C12,Peace number environment need subject charge network first detail south.
PRD-084FF6CE613,UrbanEdge Expanded needs-based pricing structure,CAT-0007,,NorthStar,SUP-FD9D5ABF67E,534.2,220.42,28.631,True,2025-08-03,,SKU-E25027DB4BD,West before science without especially main believe.
PRD-7080483626E,PrimeCore Face-to-face disintermediate knowledgebase,CAT-0031,,UrbanEdge,SUP-8CC1F834771,724.85,341.44,1.384,True,2025-09-09,,SKU-06E1BBDD20B,Close community detail blue draw final often outside hit degree beyond bank Republican kind school his.
PRD-13000546CC9,PrimeCore Multi-tiered 3rdgeneration moratorium,CAT-0026,,GreenLeaf,SUP-3914B10A77C,168.46,107.39,44.754,True,2024-07-22,,SKU-02E6CC0CF86,Day pull job themselves garden again medical hold kind day certain.
PRD-AEF20431A19,SwiftLine Total systemic implementation,CAT-0024,,TechPulse,SUP-769EF202E8E,778.12,348.92,2.326,True,2021-11-29,,SKU-FC06A650930,Small debate fire if eat fact discuss over like.
PRD-0715A661323,TechPulse Re-contextualized dynamic project,CAT-0007,,EcoVibe,SUP-C6722249640,1674.97,880.53,17.255,True,2021-08-25,,SKU-C73A92568EA,Laugh son home generation herself make right training.
PRD-138D36579A8,ZenCraft Function-based grid-enabled emulation,CAT-0025,,ZenCraft,SUP-06191A1B05A,1181.5,616.08,20.99,True,2021-12-20,,SKU-381ACF62C8D,Hand young long collection table population out special suffer without hair.
PRD-ADC3C0537BB,GreenLeaf Cross-group tertiary complexity,CAT-0020,,EcoVibe,SUP-1219E469671,952.27,621.51,45.149,True,2025-04-09,,SKU-D2DD14BF799,Past need economy moment effort chance center job.
PRD-329B3CEFE6E,AquaFlow Enterprise-wide discrete installation,CAT-0010,,EcoVibe,SUP-C82E262A39C,1801.41,1117.2,22.507,True,2025-10-25,,SKU-1947B33624B,Coach at the per of situation the term scientist explain like.
PRD-F80D8363BFD,NorthStar Down-sized disintermediate adapter,CAT-0028,,EcoVibe,SUP-94CC2BE3AD2,427.72,161.29,21.826,True,2023-08-12,,SKU-E286388A71D,Owner baby significant especially situation move single network hard condition.
PRD-DD91E05E120,IronBark Enterprise-wide dynamic toolset,CAT-0005,,EcoVibe,SUP-4DAB28C9C9A,1669.05,672.89,27.863,True,2024-02-26,,SKU-F405D7B536F,For commercial evening spend may thus hour.
PRD-2B12DEBF7C4,NorthStar Phased coherent capacity,CAT-0034,,PureForm,SUP-10E37BE2016,1041.78,694.73,5.715,True,2022-05-09,,SKU-A9614FDB056,Technology strong off evidence early compare body eat policy senior.
PRD-BF9354EB62A,EcoVibe Multi-tiered client-driven ability,CAT-0007,,SilverPeak,SUP-7A7F084B66A,1167.44,800.79,5.139,True,2021-11-10,,SKU-AF2E27426F1,Leave sometimes quality house must identify modern while wall government painting.
PRD-307D96F565F,SwiftLine User-friendly impactful system engine,CAT-0032,,SilverPeak,SUP-2BA40E5324D,691.02,320.88,23.705,True,2025-01-23,,SKU-A0F33238FA7,Model imagine me matter source deal outside happen fear page include.
PRD-1C64A811AC7,SwiftLine Multi-layered 4thgeneration functionalities,CAT-0003,,SwiftLine,SUP-A849E8BF8F3,1238.4,708.77,34.557,False,2023-05-19,,SKU-9BA12679278,Cup administration itself point chair tend so see power few each administration dinner keep.
PRD-D1214100555,BlueHorizon Persistent transitional Local Area Network,CAT-0020,,PrimeCore,SUP-F4E1BF1C5A1,540.83,242.82,42.158,True,2023-12-04,,SKU-5629D728C94,Think leg indeed anything way today two far apply let hit president.
PRD-BB66EB31CF0,PrimeCore Right-sized explicit help-desk,CAT-0029,,PureForm,SUP-487421E8BDE,1945.13,760.9,13.544,True,2023-08-30,,SKU-52474203663,Necessary American wonder suggest attack former financial medical action big season no art meeting piece.
PRD-A35E87BA705,ZenCraft Organized impactful groupware,CAT-0027,,VoltEdge,SUP-AEAD79085A8,379.93,146.1,37.999,True,2023-05-11,,SKU-27B81D6CD5F,Least perform expect anything military but just maintain shake already single rock not attack why usually.
PRD-B25EF41ACB0,PrimeCore Switchable transitional intranet,CAT-0033,,SwiftLine,SUP-AE6A471A57B,1032.96,375.57,39.048,True,2023-05-23,,SKU-7FF45BF0ED4,Century several cultural pattern every detail analysis activity card industry create.
PRD-FA7B9B107AD,UrbanEdge Distributed interactive neural-net,CAT-0004,,UrbanEdge,SUP-5C82DF55CC0,351.61,228.57,22.877,True,2025-06-18,,SKU-13236580ED4,Effort trouble a at teach enter lot at life wonder understand management bag least tonight.
PRD-6CD5AFCC626,NovaWave Multi-layered methodical firmware,CAT-0026,,AquaFlow,SUP-BBA152C542E,551.59,347.17,34.091,True,2024-07-25,,SKU-5A775DCE995,Next threat sport former professor money property structure operation radio south sing early spring its.
PRD-DDAD3DD8100,GreenLeaf Profound exuding methodology,CAT-0036,,BlueHorizon,SUP-91C3E48834B,894.98,612.35,8.259,True,2022-11-14,,SKU-2BBE185BF2B,Anything option soon election station never such despite what less check better my.
PRD-A0FCB877D4F,SwiftLine User-friendly impactful instruction set,CAT-0004,,TechPulse,SUP-855E8D35E44,1379.26,571.05,39.014,True,2023-04-26,,SKU-90A5BF36FB3,Former ball class loss up at finish threat itself spring child list air visit brother.
PRD-1228D202F80,AquaFlow Pre-emptive hybrid parallelism,CAT-0027,,NovaWave,SUP-5064F30F1ED,454.1,173.78,43.245,True,2022-09-09,,SKU-BA2A3A2E83C,If support expert particular close city force heavy bar bank.
PRD-518CD8CC5CA,TechPulse Advanced coherent moratorium,CAT-0001,,UrbanEdge,SUP-9F7263ADAB4,950.82,335.57,30.456,True,2025-06-12,,SKU-D65E39F4D0F,Manage begin wide space possible yeah able concern card worker happen rate step.
PRD-A463FA0BF76,IronBark Re-engineered background analyzer,CAT-0025,,ZenCraft,SUP-686310CF26D,1420.19,582.49,23.004,True,2023-04-15,,SKU-0F7A0FD3F26,Throughout form although old write pass start court color.
PRD-18682099ED0,SilverPeak Pre-emptive bi-directional flexibility,CAT-0007,,NorthStar,SUP-E72AF67AA51,1043.67,573.44,49.972,True,2023-06-15,,SKU-0206C8F4BBD,Fact student author partner catch left system church simply method market difference exist hotel full clear.
PRD-8CABF3F6922,PrimeCore Organized heuristic migration,CAT-0020,,AquaFlow,SUP-EB5D39C97B4,1125.11,604.76,24.139,True,2023-11-09,,SKU-A323CE7CB8E,Family relationship husband southern dog world finally force drive chance choice.
PRD-80562F07591,AquaFlow Reverse-engineered bottom-line circuit,CAT-0020,,UrbanEdge,SUP-9738521401C,653.65,268.49,25.913,True,2021-12-02,2026-04-13,SKU-AB18FE9A8D7,Your call reveal executive four floor dream loss.
PRD-6B0FBCA067E,TechPulse Stand-alone static secured line,CAT-0002,,AquaFlow,SUP-6BCE89892BD,811.18,347.05,49.874,True,2023-07-19,,SKU-9A0E54D5170,Role few remember time prevent hair hospital generation any subject sound hope speech less whom.
PRD-A8ECE650D17,VoltEdge Inverse local challenge,CAT-0013,,BlueHorizon,SUP-A7A31DEFA51,779.61,244.9,35.697,True,2025-05-21,,SKU-2B801FE6808,Seat religious probably when seem test contain than clearly economy behavior then.
PRD-EEB32D68EF9,BlueHorizon Balanced client-driven encoding,CAT-0033,,PrimeCore,SUP-5EB43F3C4B2,954.09,645.22,42.048,True,2023-03-06,,SKU-2F8C4FA3321,Page whatever trade result individual side place represent song health able lot station may decision.
PRD-EDC5079FD2A,PrimeCore Switchable user-facing synergy,CAT-0036,,PureForm,SUP-79D398A1D82,199.72,70.14,47.351,True,2023-03-02,,SKU-3E47D9445F3,Event hospital more opportunity unit cultural show rule always who opportunity face you lead.
PRD-DD2C1B65A9A,ZenCraft Ameliorated incremental parallelism,CAT-0020,,SwiftLine,SUP-A849E8BF8F3,448.4,174.58,18.647,True,2022-12-06,,SKU-9EB1EE2CD52,Whole artist stop individual less this occur type strong development enter through system stage protect often.
PRD-9B1C6382726,AquaFlow Adaptive multi-tasking emulation,CAT-0005,,GreenLeaf,SUP-3908ADFC507,239.97,77.14,25.074,True,2023-06-22,,SKU-7F214CADC30,Develop start dream able answer away sort.
PRD-8BD09FFDCEC,ZenCraft Quality-focused intangible adapter,CAT-0010,,TechPulse,SUP-F917A1B15E2,600.22,193.05,17.199,True,2024-02-29,,SKU-D69CC1490BE,Than run short small shoulder professional market oil move need sister talk understand home.
PRD-DE907AF2DFE,ZenCraft Enhanced needs-based projection,CAT-0012,,PureForm,SUP-FFAD2C7FE14,1973.37,705.06,24.43,True,2025-02-06,,SKU-7EE8DA19FE4,Add involve forget early look between use room college factor.
PRD-76D9BA40F27,PrimeCore Diverse interactive database,CAT-0014,,PureForm,SUP-68FE7A5B22B,1270.83,383.65,8.513,True,2022-10-17,,SKU-49066BC36F8,Guess share eye young reality police baby choose building.
PRD-29C196C81CF,SilverPeak Front-line asymmetric time-frame,CAT-0028,,AquaFlow,SUP-D82E6D26EDF,1528.32,512.32,20.229,True,2026-02-20,,SKU-5A8446E1195,Whole box later building she single let business property everything bar.
PRD-7D906AA7647,BlueHorizon Multi-channeled context-sensitive info-mediaries,CAT-0001,,IronBark,SUP-487421E8BDE,80.26,30.48,37.867,True,2025-05-30,2026-06-07,SKU-336731B8B92,Nation economy adult trial source soldier beat as certainly civil.
PRD-5E050F93B4F,VoltEdge Public-key content-based matrices,CAT-0023,,PrimeCore,SUP-81B1C7515D1,1255.24,501.51,5.225,True,2025-07-16,,SKU-05F25D3FA65,Goal future home series billion mention speech defense couple point similar security at year dinner prevent.
PRD-6AA30D1C5E7,PrimeCore Proactive next generation throughput,CAT-0030,,VoltEdge,SUP-06191A1B05A,135.25,43.05,29.859,True,2026-01-08,,SKU-F2EDB1FAF15,Hold politics current among laugh about green write value possible indeed study wide television.
PRD-1E59F7CF472,IronBark Cross-platform radical model,CAT-0032,,BlueHorizon,SUP-5766D441B92,1990.97,870.24,9.502,True,2021-12-13,,SKU-9BA7AC8D6EF,She or list network necessary seven build specific skill point early Mr international although blood.
PRD-6ABE679FB07,VoltEdge Synchronized client-driven standardization,CAT-0009,,UrbanEdge,SUP-7F0056F2E1E,809.77,316.92,1.193,True,2026-02-24,,SKU-55BE4CCB79A,Staff yourself exactly sure wonder window hair marriage school imagine ago.
PRD-554895F279D,SwiftLine Enterprise-wide transitional array,CAT-0017,,PureForm,SUP-6F3633B308E,1423.66,878.19,31.194,True,2022-12-07,2024-07-15,SKU-84643B64EFD,Use owner surface guy believe enough free thousand consumer.
PRD-C3BBAA60FA3,VoltEdge Configurable discrete application,CAT-0008,,SwiftLine,SUP-DBE38ABF1D3,1308.87,403.0,19.075,True,2022-07-29,,SKU-A272456E7D6,Find set senior tree bag require very that national trade price.
PRD-F392966CA3F,AquaFlow Open-architected web-enabled analyzer,CAT-0001,,PrimeCore,SUP-10E37BE2016,310.49,179.49,33.117,True,2022-01-09,,SKU-1E4E228EB29,Try information price especially appear attention we open blood local light.
PRD-C2877FA7B45,ZenCraft Quality-focused bi-directional firmware,CAT-0007,,NovaWave,SUP-7E5E956E2B3,1213.24,430.54,30.923,True,2023-04-22,,SKU-DDB675665CE,Opportunity night some bank collection possible notice term piece.
PRD-8193C2461DC,PureForm Extended upward-trending strategy,CAT-0017,,ZenCraft,SUP-06191A1B05A,997.99,542.51,48.659,True,2021-08-12,,SKU-8C06B9A3BC5,College whatever tell meeting writer accept mission event some.
PRD-601ACBFED3B,IronBark Ergonomic modular neural-net,CAT-0014,,VoltEdge,SUP-0051DAA7B99,324.95,168.73,16.597,False,2025-05-07,,SKU-DCCAB7308F2,Arrive decision project court month general identify opportunity treat explain.
PRD-566D45900FA,AquaFlow Decentralized tertiary instruction set,CAT-0032,,TechPulse,SUP-FE35EF503CD,1814.23,1150.39,38.998,False,2022-10-03,,SKU-5B20D595366,Possible marriage within if course education campaign continue political build provide.
PRD-8D4DA31EE89,GreenLeaf Balanced discrete encryption,CAT-0019,,PrimeCore,SUP-D7AB0FBA4B7,1810.03,1009.52,2.599,True,2022-03-08,,SKU-E11BF0CE84A,Rule range card design where off prepare.
PRD-7F066290C4D,AquaFlow Total 24/7 installation,CAT-0021,,SwiftLine,SUP-16C6552F9F1,1705.24,757.27,5.883,True,2025-01-21,,SKU-05E913F5B72,Game language chair possible but hard with her.
PRD-F75E3442F15,AquaFlow Grass-roots leadingedge protocol,CAT-0011,,BlueHorizon,SUP-F06DD0E7A9B,24.3,8.64,44.737,True,2024-01-31,,SKU-242AFAB2955,Tax certainly home could program water drug major event any.
PRD-3ED4BEDF24C,BlueHorizon Persistent cohesive approach,CAT-0012,,EcoVibe,SUP-F200D5FACB9,1467.47,658.97,20.072,True,2021-07-18,,SKU-6D398FFDAE7,Security modern data book expert exist computer shoulder.
PRD-6C452CB37F5,SwiftLine Virtual multi-tasking architecture,CAT-0011,,EcoVibe,SUP-81B1C7515D1,1381.36,678.66,34.839,False,2023-11-10,,SKU-D641DF1867D,Lawyer field difference cut tell style white especially lose just card sit population his worry necessary.
PRD-A0CDDDD4265,SilverPeak Digitized bifurcated flexibility,CAT-0031,,PureForm,SUP-F6CE1736067,322.99,150.65,33.952,True,2024-09-08,,SKU-B9ACEC05897,Miss ready even probably son second after note those drop executive special.
PRD-5901D8EBE97,AquaFlow Synchronized next generation pricing structure,CAT-0009,,GreenLeaf,SUP-AEAD79085A8,720.4,224.42,5.736,True,2025-04-04,2027-09-21,SKU-EF1BF9CF46A,Sometimes morning consumer market more chance after shoulder show information game loss cost run result.
PRD-AF3A1905C46,ZenCraft Total encompassing parallelism,CAT-0034,,PureForm,SUP-C3BE301917E,1311.67,399.99,28.875,True,2023-08-15,,SKU-539338AB159,Pick prove whether north ground here person three foot tax.
PRD-E8BD464EAC5,NovaWave Virtual disintermediate monitoring,CAT-0007,,SwiftLine,SUP-996D2D71228,1341.34,583.91,36.36,True,2023-04-15,,SKU-56E4EF4FB3E,Manage issue none ready billion time discuss term day include you authority.
PRD-CCEA3ABEFA7,ZenCraft Reactive leadingedge structure,CAT-0036,,IronBark,SUP-988A82D2380,1284.6,461.76,2.823,True,2024-11-17,,SKU-6EE36460B23,Determine Democrat he already activity onto build exactly open.
PRD-D84CF5B4168,ZenCraft Expanded background Graphical User Interface,CAT-0011,,EcoVibe,SUP-5766D441B92,1698.45,1088.28,24.633,True,2023-09-29,,SKU-C67E1380C19,Partner behavior economy our second voice drop live everyone cold.
PRD-F4E7B24CF77,AquaFlow Upgradable 24hour matrix,CAT-0025,,SwiftLine,SUP-F5550365C51,105.45,41.03,4.034,True,2025-04-03,,SKU-D8DD9C62A5E,Somebody thought beyond mean director offer a recent various send.
PRD-C8FC15806D4,BlueHorizon Down-sized 4thgeneration support,CAT-0008,,GreenLeaf,SUP-C3BE301917E,180.6,90.19,32.703,True,2024-04-07,,SKU-8B717066D91,Wonder occur project court state doctor and conference.
PRD-855E6F40D42,EcoVibe Exclusive clear-thinking frame,CAT-0020,,IronBark,SUP-E72AF67AA51,1116.48,335.02,28.16,True,2025-08-07,,SKU-A0B882879E4,Article last peace all rise right happen series seven strong it reach street city.
PRD-A63E5D7D901,ZenCraft Down-sized holistic alliance,CAT-0015,,ZenCraft,SUP-3B9176F532D,685.0,431.64,16.665,True,2023-05-23,,SKU-39712E708E2,Compare successful inside be church available indeed itself record coach require research this most too.
PRD-5B3CBD3486A,GreenLeaf Reduced full-range knowledge user,CAT-0008,,EcoVibe,SUP-ACB2C1E8DD3,1434.73,638.91,32.98,False,2024-06-10,,SKU-5DDE30A2176,Stock organization produce democratic last common student knowledge firm.
PRD-85FA04940AB,NovaWave Upgradable zero administration adapter,CAT-0034,,BlueHorizon,SUP-371E01CD40B,1269.15,786.83,5.405,True,2024-07-06,,SKU-7331BBD305A,Image heart movement until themselves break reason too discover record.
PRD-104504A2259,SwiftLine Customizable next generation matrices,CAT-0007,,PrimeCore,SUP-988A82D2380,1644.57,981.82,9.876,True,2026-03-15,,SKU-ACFDC8CF0EA,Training oil scene career military much discussion call traditional meet parent this drop.
PRD-429D65995BB,UrbanEdge Mandatory multi-tasking monitoring,CAT-0022,,EcoVibe,SUP-C82E262A39C,435.1,274.04,20.782,True,2024-03-31,,SKU-7A4674E3D52,Employee forward carry condition into sure day sort.
PRD-6F6CD5DDD3B,GreenLeaf Sharable background model,CAT-0030,,AquaFlow,SUP-09E0A497813,1179.68,718.26,47.814,True,2022-08-13,,SKU-57B98BAD684,Person author return national scene focus clearly everybody suggest.
PRD-5CC62880C0D,IronBark Virtual 24/7 time-frame,CAT-0028,,ZenCraft,SUP-3BD36A168F4,1063.08,339.58,24.198,True,2021-09-04,,SKU-2B432499D60,Simple real television rich base close score.
PRD-83E8DDB3C8C,VoltEdge Configurable attitude-oriented solution,CAT-0009,,EcoVibe,SUP-4DAB28C9C9A,358.52,190.53,32.91,True,2024-08-30,,SKU-F7314895D93,Lose south keep thus positive arm piece why ago change.
PRD-E62C13FEBFA,SilverPeak Multi-tiered systematic budgetary management,CAT-0016,,PrimeCore,SUP-1219E469671,1763.37,824.32,48.183,True,2023-04-08,,SKU-CF514B71D74,Population sell end be spend outside office live make travel baby compare shake may.
PRD-BB3C92D883F,VoltEdge Intuitive homogeneous leverage,CAT-0033,,PrimeCore,SUP-371E01CD40B,271.08,126.08,27.436,True,2025-05-29,,SKU-DBB9EF89602,Medical level analysis any product though help.
PRD-FDC57700A9B,UrbanEdge Cross-group high-level success,CAT-0019,,AquaFlow,SUP-91C3E48834B,1109.4,429.27,46.067,True,2024-08-30,,SKU-BE79BC95FC5,Every change help but include something memory wrong hard any financial color officer role need.
PRD-F065B4C38CC,NovaWave Phased actuating installation,CAT-0021,,VoltEdge,SUP-FB20EBEC9CE,1950.48,723.87,38.063,True,2021-09-21,,SKU-E56106101EB,Drive own pass least great your sign single well task.
PRD-C3859F95FD3,AquaFlow De-engineered asymmetric approach,CAT-0035,,PrimeCore,SUP-957082F21D6,1885.63,1101.3,40.434,True,2024-02-12,2025-12-05,SKU-9624C3A6578,Soon up tend education more three trip school energy safe while.
PRD-F7BA456FC61,PrimeCore Reactive methodical methodology,CAT-0011,,PrimeCore,SUP-94CC2BE3AD2,110.86,35.77,12.603,True,2024-09-11,,SKU-3172A614D3E,Middle her shake month ask environmental choice assume recent people.
PRD-5371E0C1B2D,NorthStar Down-sized multi-state orchestration,CAT-0023,,ZenCraft,SUP-713BFCACB32,593.81,357.14,5.214,True,2022-12-25,,SKU-9B9B88E1716,Imagine citizen drug information response happy rise month degree finally sing.
PRD-BA933C65970,NovaWave Balanced human-resource frame,CAT-0025,,UrbanEdge,SUP-E72AF67AA51,1730.36,1032.96,39.237,True,2021-12-07,,SKU-49592F653F7,Hope great seek serious term amount idea director put future raise family where treatment age be.
PRD-BC1A2511AED,SwiftLine Open-source even-keeled frame,CAT-0027,,PureForm,SUP-A0B677C1D9A,1330.66,892.33,15.701,True,2023-05-21,2025-10-16,SKU-96977E7BE71,Office spring measure truth sign room happy new may condition word former win letter story.
PRD-9C2FCB4ACED,ZenCraft Team-oriented global alliance,CAT-0029,,ZenCraft,SUP-48BEA9808F7,410.16,265.6,45.583,True,2021-10-31,,SKU-D6117C3F193,Rather arm table draw trouble decade share great stock election fire.
PRD-375017D5952,SilverPeak Object-based upward-trending definition,CAT-0013,,PureForm,SUP-A7A31DEFA51,1511.44,783.9,48.218,True,2025-01-06,,SKU-3C451445890,South bed represent lawyer letter these buy answer wish.
PRD-1A0F700C0E7,TechPulse Cross-group responsive service-desk,CAT-0033,,EcoVibe,SUP-FF6C3B1149A,1366.9,512.3,2.128,True,2022-09-19,,SKU-439E2AC2B19,Manage care popular yourself always image alone baby base seek.
PRD-7D81225EAAD,NorthStar Proactive well-modulated Graphic Interface,CAT-0022,,GreenLeaf,SUP-E6661451775,326.05,208.15,46.881,False,2025-04-11,,SKU-FA97A7E2101,Believe whether teach single result modern across treatment decade ago specific only free.
PRD-DE9CB1C2DE3,AquaFlow Reactive clear-thinking policy,CAT-0020,,GreenLeaf,SUP-855E8D35E44,1195.78,728.79,27.553,False,2023-07-28,,SKU-8769C555010,Under each help line reflect enough exist without build right indeed able perform degree happy.
PRD-9E2D0C669DF,NovaWave Devolved analyzing archive,CAT-0005,,PureForm,SUP-11B831089BB,1053.16,719.09,8.053,True,2025-06-05,,SKU-C8A4152CC38,Page speak that police offer board factor discuss morning gas ago.
PRD-A484047B9E2,AquaFlow Open-source content-based concept,CAT-0022,,BlueHorizon,SUP-DF351C3CCD4,702.06,458.7,14.749,True,2022-03-20,,SKU-9ADEEC442A9,Walk paper media available later friend industry begin value.
PRD-2EB30A0CE9D,PureForm Upgradable explicit capacity,CAT-0001,,EcoVibe,SUP-C6722249640,952.34,499.53,17.366,True,2024-12-13,,SKU-285CE6935AF,Movie wait amount happen again society down very investment whom season mind benefit second interview.
PRD-3D021A4E48D,NorthStar Balanced content-based approach,CAT-0021,,SwiftLine,SUP-FB20EBEC9CE,1837.62,730.51,19.355,True,2025-09-11,,SKU-DAEA4936189,Those guess huge parent stand several hit rate authority wait defense well should effect future.
PRD-1D46FAE1532,BlueHorizon Optional multimedia neural-net,CAT-0033,,PureForm,SUP-E72AF67AA51,1823.12,1146.46,22.333,False,2021-10-14,,SKU-A37AC7B20EF,Job board phone magazine several popular central decision modern.
PRD-C622EB7243A,EcoVibe User-friendly 6thgeneration budgetary management,CAT-0011,,PureForm,SUP-4FBAC18B408,389.06,196.69,26.707,True,2022-10-30,,SKU-16EF1020794,Fight never soldier world sister garden down television tree say.
PRD-C63710B653A,AquaFlow Open-source 6thgeneration data-warehouse,CAT-0028,,ZenCraft,SUP-3B1211E5552,1260.88,485.78,10.358,True,2024-02-17,,SKU-98150154073,Population pass buy bill have reality adult state medical year.
PRD-FCCED195B30,ZenCraft Cloned explicit forecast,CAT-0005,,VoltEdge,SUP-A0B677C1D9A,1484.04,703.58,7.772,True,2024-05-21,,SKU-FBD2C43076F,Consider administration yet yeah old close series relationship perhaps personal short of heart sister fast.
PRD-7D647F18941,PureForm Robust well-modulated policy,CAT-0017,,NovaWave,SUP-527D4D73F2A,179.6,57.78,28.791,True,2024-04-01,,SKU-43D5E00740A,Bed mission certain situation often PM notice chair north family sign thought notice society.
PRD-1CB7EC41832,SwiftLine Enhanced content-based benchmark,CAT-0021,,NorthStar,SUP-4DAB28C9C9A,779.13,430.15,33.698,True,2025-09-29,,SKU-F04A7F79DDF,Stuff southern development sister simply involve nor whether area.
PRD-BF4053A9AED,SilverPeak Ameliorated next generation leverage,CAT-0003,,VoltEdge,SUP-527D4D73F2A,1238.61,746.12,17.949,True,2024-08-04,,SKU-F442C5F94E1,Huge brother shake win air kind see finally wall.
PRD-368EB2019A0,PrimeCore Programmable real-time definition,CAT-0029,,SwiftLine,SUP-1219E469671,1373.33,745.21,41.124,False,2025-02-03,,SKU-111813D2B32,Prove own gun during wear catch today serious structure wonder stock today.
PRD-10F0D89CBD4,PureForm Switchable bottom-line circuit,CAT-0035,,PrimeCore,SUP-4D6AB951BF4,443.63,265.6,7.289,True,2026-04-03,,SKU-BB76969A71D,Particular game near support chair opportunity grow put its entire situation him her imagine authority.
PRD-D5818DD2AF4,BlueHorizon Advanced next generation matrices,CAT-0001,,NovaWave,SUP-3C49978EE67,1591.06,941.48,7.155,False,2025-08-11,,SKU-80A0907C7A2,Better store think short southern finish front under build successful since human chance.
PRD-CA411FE1D38,EcoVibe Visionary fault-tolerant migration,CAT-0020,,UrbanEdge,SUP-F9C75856D9B,791.19,410.64,37.097,True,2024-06-02,,SKU-22A5669841E,Personal American ahead where long difference according system its hospital those.
PRD-A93B4BDAC60,TechPulse Centralized bifurcated task-force,CAT-0011,,TechPulse,SUP-049922408F5,1811.73,1160.56,30.883,True,2021-11-02,,SKU-238B81676E1,Mean avoid property sport friend wide take answer at month partner evidence fall.
PRD-BAA5FB9198F,NorthStar User-centric fresh-thinking application,CAT-0036,,GreenLeaf,SUP-D410FCFC211,1343.6,707.97,27.528,True,2024-07-06,2026-01-23,SKU-6B2A71FFCAB,Imagine concern picture cultural old kitchen in century role determine evidence admit manager kind.
