PRODUCT_ID,PRODUCT_NAME,CATEGORY_ID,SUBCATEGORY,BRAND,SUPPLIER_ID,UNIT_PRICE,UNIT_COST,WEIGHT_KG,IS_ACTIVE,LAUNCH_DATE,DISCONTINUE_DATE,SKU,DESCRIPTION
PRD-48ED7240370,BlueHorizon Diverse analyzing structure,CAT-0023,,TechPulse,SUP-C6722249640,398.85,212.28,32.808,True,2022-11-30,,SKU-5863102BEA8,Those rise several in candidate case affect sometimes second man personal listen his answer.
PRD-BFB46BB958A,GreenLeaf Total real-time architecture,CAT-0022,,SilverPeak,SUP-8FEB009A2AD,1800.74,769.12,15.353,True,2022-04-28,,SKU-B3687383BD5,Age view push enjoy wife cup law become car use group.
PRD-66D7F0535D2,SwiftLine Exclusive grid-enabled initiative,CAT-0011,,NorthStar,SUP-AB556BFA48E,732.16,312.29,12.384,True,2026-02-09,,SKU-4DBA4899E40,Level until less daughter you traditional question bad.
PRD-8ABA08E8A41,TechPulse Multi-tiered bifurcated definition,CAT-0022,,IronBark,SUP-4B218BE29EF,875.07,556.58,23.196,True,2022-05-02,,SKU-54B5612297E,Draw message prove car many of general building design avoid property father enough.
PRD-B24CB4A8AA1,SilverPeak Down-sized optimal Graphic Interface,CAT-0006,,ZenCraft,SUP-F4E1BF1C5A1,1105.59,409.41,42.95,True,2021-10-09,,SKU-CD8ACDC6CD6,Cell how member win behind every yet.
PRD-33BB71E96DB,EcoVibe Expanded systemic extranet,CAT-0005,,IronBark,SUP-305A80CA3C6,530.15,347.0,42.494,True,2022-09-11,,SKU-7EC09838566,Huge move until toward scientist matter message trip.
PRD-A62A0C35773,UrbanEdge Diverse scalable array,CAT-0003,,NovaWave,SUP-3D203565FF1,1159.91,704.85,27.219,True,2021-11-25,,SKU-51C7E8E6CB2,Thus open still bill cover mind wind commercial national same man rule paper doctor.
PRD-EEB34C14ACB,UrbanEdge Focused needs-based encryption,CAT-0019,,TechPulse,SUP-D7AB0FBA4B7,1551.52,692.49,25.106,False,2023-08-17,,SKU-0C864168697,Summer concern race five ahead director seek where.
PRD-96D5D681B4D,PureForm Total optimizing moratorium,CAT-0011,,PureForm,SUP-F280D9BC138,26.13,10.34,7.104,True,2021-08-23,,SKU-6E42BA47C0F,Idea until budget long article team market too million space team administration share.
PRD-243C6401C3D,TechPulse Digitized attitude-oriented protocol,CAT-0031,,BlueHorizon,SUP-958D5AAE392,1133.8,735.7,11.019,True,2023-05-19,2026-06-13,SKU-F8BD0A10AFD,Congress pick foreign city yeah quickly process address friend.
PRD-94379C28760,NovaWave Customer-focused systemic firmware,CAT-0024,,SwiftLine,SUP-0FBC16F09CD,471.87,267.76,45.903,True,2026-05-25,2031-01-12,SKU-4BF816468C3,Notice run mission show company word catch nothing why sense western newspaper move.
PRD-459BD0B7D50,NovaWave Front-line intermediate process improvement,CAT-0018,,ZenCraft,SUP-16C6552F9F1,651.52,378.86,13.239,True,2024-11-19,,SKU-7A577D4B149,My situation test well camera truth surface sometimes week reality discover success item rest respond economy.
PRD-E963A62A2FD,AquaFlow Stand-alone clear-thinking framework,CAT-0005,,NovaWave,SUP-9F7263ADAB4,1309.08,584.01,18.879,True,2026-04-19,,SKU-E2D2CB4D2ED,Front save mention picture positive exist later nation leader special tree receive kid ground condition time.
PRD-414906358A1,GreenLeaf Networked mission-critical customer loyalty,CAT-0031,,IronBark,SUP-4017F378086,709.03,458.8,0.429,True,2023-07-04,,SKU-71C599C4299,Shoulder prevent ago past ever sister white as physical wind manager mother his change perhaps.
PRD-D9146A210BA,PrimeCore Profit-focused modular structure,CAT-0014,,TechPulse,SUP-2A28BC397DF,463.83,234.61,7.952,True,2026-01-12,,SKU-660861BC944,Student can might cultural yes although poor five modern.
PRD-86E9D618DF4,BlueHorizon Enterprise-wide systemic product,CAT-0008,,GreenLeaf,SUP-5D80DD8E3DB,1323.91,616.74,23.993,True,2023-06-29,,SKU-0F48304A720,Happy receive third professional test sense hope road forward lead.
PRD-7C460C1BDA8,NorthStar Synergistic bottom-line concept,CAT-0009,,SilverPeak,SUP-2FD8B370625,1667.56,515.24,8.14,True,2021-09-19,2025-12-04,SKU-890E566A136,Tonight compare second system environmental consumer model leave hour cell step.
PRD-624BE4C7311,IronBark Enterprise-wide scalable encryption,CAT-0012,,NovaWave,SUP-58B6F39452A,298.0,109.23,30.008,True,2024-07-15,2029-07-27,SKU-A6D1C5E221B,Raise school suggest smile store develop wait national top.
PRD-DDF970E9F24,EcoVibe Customer-focused global initiative,CAT-0014,,GreenLeaf,SUP-2BA40E5324D,1457.31,915.95,49.64,True,2024-05-06,,SKU-7F13001107B,End range trouble cost seven reveal usually concern war.
PRD-1CEED31644B,PureForm Re-engineered composite initiative,CAT-0012,,SilverPeak,SUP-8FEB009A2AD,1661.58,897.81,25.589,True,2023-06-12,,SKU-E95A31DCE13,Develop reason gas part rather bill team vote blood represent hard agent position million what wear.
PRD-D4A7B8004A5,EcoVibe Ameliorated reciprocal Graphic Interface,CAT-0015,,SwiftLine,SUP-AA8E0EDAE54,1845.09,993.79,6.697,False,2024-04-11,,SKU-1FC9363D8E3,Significant expert energy account fill perhaps there throw station avoid strategy trial out close.
PRD-48493ADDD8C,ZenCraft Triple-buffered full-range paradigm,CAT-0010,,SilverPeak,SUP-8CC1F834771,1819.13,1043.72,8.953,True,2022-07-05,,SKU-983F1076FBD,Especially also stuff decision film foot law force foreign blue.
PRD-16B91A4820F,PureForm Multi-lateral regional data-warehouse,CAT-0008,,EcoVibe,SUP-0051DAA7B99,1756.12,900.14,33.004,True,2025-02-11,,SKU-5DA05A534B7,Live suffer modern draw international surface animal where entire suggest recent poor board.
PRD-CB99282C123,AquaFlow Cross-group 5thgeneration time-frame,CAT-0028,,NovaWave,SUP-10E37BE2016,7.39,4.99,18.582,False,2026-03-16,,SKU-5A7CA542B78,Concern him more young receive model no painting strong serious according guess.
PRD-1AA8FCAE9AA,PureForm Profound multi-tasking open architecture,CAT-0025,,BlueHorizon,SUP-09E0A497813,462.83,287.38,40.251,True,2022-09-08,,SKU-52843A02B3D,I three very newspaper tree simply indicate western tell on indeed senior.
PRD-FDD0E964611,PrimeCore Grass-roots exuding concept,CAT-0031,,PureForm,SUP-A9E8F4728E7,1154.36,542.78,45.513,False,2024-03-07,,SKU-3AB659104CA,Manage full front scientist protect must fund open who.
PRD-D9AF34D4EEB,NorthStar Intuitive zero tolerance structure,CAT-0001,,SilverPeak,SUP-06191A1B05A,1089.74,439.3,5.98,False,2025-06-13,,SKU-59D6EC170C5,Explain maybe fight pass budget bar really world agent usually according always choose fill police only.
PRD-859A71D37CD,BlueHorizon Compatible disintermediate capacity,CAT-0007,,TechPulse,SUP-D82E6D26EDF,1377.09,587.14,32.614,True,2025-11-07,,SKU-979C562856D,Son than attorney accept future almost daughter plan.
PRD-BD57ACA813B,PrimeCore Enterprise-wide systemic attitude,CAT-0026,,PureForm,SUP-FDF87FA49F0,850.01,379.32,20.72,True,2024-04-06,,SKU-143DC3EF344,Field surface modern him only yet make matter sure wrong develop.
PRD-1071908493C,PrimeCore Sharable zero tolerance intranet,CAT-0020,,SilverPeak,SUP-91C3E48834B,743.57,388.12,38.732,True,2023-09-27,,SKU-1ECD7F55C6F,Poor change according hand middle school cold hard decide when moment.
PRD-71FCBFE1035,UrbanEdge Enhanced tertiary moratorium,CAT-0029,,PureForm,SUP-371E01CD40B,1728.34,600.83,47.467,True,2025-06-29,,SKU-94F84928B02,Say couple as customer century subject according figure.
PRD-BF5D814F841,SilverPeak Multi-tiered user-facing access,CAT-0004,,TechPulse,SUP-4DAB28C9C9A,1573.23,975.94,48.232,False,2021-12-26,2023-10-19,SKU-8856F837E13,Mind indeed majority daughter need generation mouth short.
PRD-0803EB5DD75,EcoVibe Triple-buffered background secured line,CAT-0005,,PrimeCore,SUP-049922408F5,945.98,510.92,18.605,True,2023-07-09,,SKU-CD1F5FBEAA4,Computer Congress glass less employee wind no enter career choice number allow central bed.
PRD-747EE5DFF2D,AquaFlow Synchronized user-facing knowledgebase,CAT-0034,,PrimeCore,SUP-C268C3B570A,1861.72,856.87,48.18,False,2025-07-19,,SKU-70ED54F0D67,Tonight network role hotel near consider keep building light as reach cup.
PRD-3A967178472,NorthStar Upgradable didactic open system,CAT-0013,,ZenCraft,SUP-8FEB009A2AD,354.67,176.54,46.545,True,2025-05-27,,SKU-D09E33EEE68,Whom what unit for common office note pass scientist thing western run son price one policy.
PRD-F848ACB8074,VoltEdge Reactive client-server encoding,CAT-0015,,SilverPeak,SUP-5EB43F3C4B2,1569.0,791.12,33.734,True,2022-09-10,,SKU-B6291BFE7A5,Foot hair who smile talk music floor vote environment.
PRD-5C6B2BF7086,PrimeCore Up-sized secondary Local Area Network,CAT-0026,,BlueHorizon,SUP-C6722249640,1951.41,653.21,19.818,True,2022-02-17,,SKU-23C5C7D103A,Despite space face walk number end effect specific simple particularly rise Congress land station.
PRD-DE1A9541005,EcoVibe Organic 24hour contingency,CAT-0036,,PrimeCore,SUP-A7A31DEFA51,1475.17,483.04,41.505,True,2025-10-06,,SKU-4FDF7A8F0D6,Company attorney area east too life money marriage both make time force often next trip.
PRD-C6D503104FF,SilverPeak Distributed 4thgeneration workforce,CAT-0013,,GreenLeaf,SUP-58B6F39452A,1926.76,791.13,28.788,True,2022-09-22,,SKU-8BD51FD32E6,Care hair role risk approach could also and.
PRD-A44C0ED0006,PrimeCore Pre-emptive real-time workforce,CAT-0022,,EcoVibe,SUP-F280D9BC138,217.4,71.51,47.84,True,2025-04-10,,SKU-6FE152BC162,Million media notice glass decision science relate head method continue PM hour article study.
PRD-821D3F8AF62,SwiftLine Visionary 6thgeneration customer loyalty,CAT-0031,,PureForm,SUP-A58BB3FCED3,1151.91,665.43,37.898,True,2025-03-22,,SKU-3A6799641A8,Everything few two population spring talk off.
PRD-98F5B90EADB,NorthStar Cloned grid-enabled complexity,CAT-0031,,EcoVibe,SUP-3D203565FF1,924.14,494.17,3.471,True,2022-01-25,,SKU-9AFDC3FD1C0,The now up behavior single poor cold unit walk see.
PRD-6A25D45AD89,BlueHorizon Cross-group exuding customer loyalty,CAT-0027,,BlueHorizon,SUP-92EF2BF29EB,1355.44,531.29,26.829,True,2024-10-18,,SKU-0CD70AEA315,Everyone test memory arm statement treatment office yeah bar rather matter participant boy huge.
PRD-69042C1E9E9,VoltEdge Upgradable coherent budgetary management,CAT-0022,,EcoVibe,SUP-8140077879F,578.14,265.7,46.577,True,2024-08-24,,SKU-3DF461F26B2,Church term under whether improve sell cause boy sign pull.
PRD-F9075ADB643,VoltEdge Multi-tiered impactful benchmark,CAT-0013,,GreenLeaf,SUP-8F034B87DDC,1789.16,729.32,10.063,True,2022-02-06,,SKU-2524F2CEFAF,Tree among pay all carry garden sea more join.
PRD-5A43EFA3EC2,UrbanEdge Secured value-added superstructure,CAT-0023,,TechPulse,SUP-7A7F084B66A,417.52,159.12,5.424,True,2022-10-02,,SKU-3793C8700C3,Already occur issue front movie produce lay theory specific since.
PRD-C6FA27D5314,PureForm Virtual zero tolerance forecast,CAT-0035,,NorthStar,SUP-0051DAA7B99,1328.53,724.75,18.623,True,2022-01-15,,SKU-639CFCEEFCB,Beyond expect smile raise personal cell front across professor.
PRD-FA2032B274D,PrimeCore Distributed radical forecast,CAT-0032,,TechPulse,SUP-67A5891A1C0,1762.57,933.82,45.809,True,2026-05-12,,SKU-047D017F026,Can style option red happen whose return style at score pretty south.
PRD-9A4674F165B,PureForm Synchronized non-volatile policy,CAT-0028,,GreenLeaf,SUP-F242F966961,1155.45,371.66,1.725,True,2022-08-02,,SKU-403A0839A59,Campaign reason market admit best why budget every interest grow force happen.
PRD-78CE464C04E,EcoVibe De-engineered didactic algorithm,CAT-0034,,GreenLeaf,SUP-AB556BFA48E,1552.93,749.88,34.492,False,2023-01-15,,SKU-A934DFFD5CD,Walk thousand sing agent wrong us institution gun class discuss manager.
PRD-98739DC101A,SilverPeak Right-sized regional approach,CAT-0017,,TechPulse,SUP-7B454167728,1164.11,500.77,13.216,True,2021-10-29,,SKU-D2487299DA1,Responsibility who issue technology against direction call example practice too garden end tell.
PRD-F0A28C6B7B1,SwiftLine Synergized responsive project,CAT-0014,,SwiftLine,SUP-371E01CD40B,689.48,257.57,37.635,True,2025-08-08,,SKU-016AB230F25,Develop report experience economic by pattern traditional.
PRD-4869AF45069,SilverPeak Proactive non-volatile throughput,CAT-0015,,ZenCraft,SUP-332689FE88F,904.2,477.93,36.069,True,2023-07-11,,SKU-4FEF6D31AE4,Happy throw final assume kind quality your head interesting common early look blood student.
PRD-AFBCEED0178,PureForm Optional 24hour budgetary management,CAT-0010,,GreenLeaf,SUP-BF95D07074B,1713.34,648.37,8.913,True,2022-10-07,,SKU-314F34263B0,Never shoulder something method although ago treatment.
PRD-04E6D08CF9B,VoltEdge Reactive discrete attitude,CAT-0021,,PureForm,SUP-AEAD79085A8,1699.53,861.33,15.072,True,2025-06-06,,SKU-7F48FBED073,Human shake bed class might name might speech prove language challenge air rest wind.
PRD-E149E758C05,NorthStar Persistent attitude-oriented customer loyalty,CAT-0014,,ZenCraft,SUP-BC1A55BB0F4,799.81,460.86,23.879,True,2024-12-29,,SKU-8EA7D294E54,Amount laugh east left director bag answer thank guess most every feel song company region.
PRD-EDAC339D6DE,NovaWave Re-contextualized intermediate contingency,CAT-0036,,IronBark,SUP-BC1A55BB0F4,672.64,298.91,17.273,True,2021-08-26,,SKU-B074A412D51,Mother month green international involve effect ahead building accept current provide the.
PRD-08144A69067,SilverPeak Open-architected cohesive workforce,CAT-0035,,TechPulse,SUP-7A7F084B66A,1360.77,737.85,14.302,True,2022-07-08,,SKU-716F417EB4B,Two stuff threat join chance good ask drive catch table affect arm entire.
PRD-E6A880F5BB2,EcoVibe Cross-platform fault-tolerant groupware,CAT-0025,,SilverPeak,SUP-E33589322D9,1550.62,742.39,23.241,True,2023-07-28,,SKU-67FF638F279,Operation sense somebody anything open project buy edge after pretty one name walk attack resource serious.
PRD-7994F9A5686,SwiftLine Self-enabling tangible flexibility,CAT-0026,,ZenCraft,SUP-527D4D73F2A,1282.96,861.41,4.048,True,2025-10-01,,SKU-F28B073C6A4,Able economic young assume six amount particular maybe space father store start upon house paper.
PRD-436BDD3926B,SilverPeak Sharable directional project,CAT-0026,,PrimeCore,SUP-DBE38ABF1D3,1307.76,763.96,39.071,True,2026-05-26,,SKU-064A832AE49,Cup opportunity rate sport him news fall improve.
PRD-E18FB5F975F,TechPulse Cross-platform coherent data-warehouse,CAT-0012,,ZenCraft,SUP-5064F30F1ED,1044.27,501.37,6.339,True,2023-05-30,,SKU-C29A5FFF19C,Expert any look entire do company focus consumer say whom prove organization old treatment.
PRD-E92BAFDDB75,UrbanEdge Organized 24/7 architecture,CAT-0011,,SwiftLine,SUP-3B1211E5552,1489.03,893.26,4.868,True,2026-06-06,,SKU-087BB214E4F,Close issue write produce ago level middle star music commercial become.
PRD-F1F40BABC82,NovaWave Diverse stable secured line,CAT-0006,,EcoVibe,SUP-840C033389A,112.38,68.37,30.943,False,2021-10-19,,SKU-0FC49C4000E,Piece produce else support top nation wind.
PRD-1B3391AFC0C,VoltEdge Multi-layered systemic standardization,CAT-0019,,GreenLeaf,SUP-95BCFC8C747,782.74,306.63,6.408,True,2021-12-10,,SKU-D5AF282CE35,Number other those sister large chair born wish while room Mr personal who until meet spring.
PRD-CA91139CB48,IronBark Quality-focused impactful firmware,CAT-0021,,ZenCraft,SUP-5A6C9C9C1D9,75.13,33.26,23.413,True,2025-09-19,,SKU-50A0F23CD90,Movement claim build water third miss scene do work win health.
PRD-61147782A58,VoltEdge Quality-focused context-sensitive approach,CAT-0035,,TechPulse,SUP-2FD8B370625,1099.35,389.22,29.919,True,2026-02-12,,SKU-34EA89C8D61,Else another listen list behavior successful success.
PRD-A1B90AE5FD9,AquaFlow Configurable exuding policy,CAT-0035,,PrimeCore,SUP-91C3E48834B,1130.15,575.68,24.134,True,2023-05-27,2026-02-15,SKU-931597262C7,Before possible base citizen through purpose opportunity social outside interest tough character risk.
PRD-2540282048F,PrimeCore Synchronized mission-critical secured line,CAT-0001,,NorthStar,SUP-06191A1B05A,734.74,296.78,40.787,True,2023-06-17,,SKU-A927F2F8A8B,Environment open director brother toward because ok.
PRD-04E730AB846,IronBark Optimized 6thgeneration methodology,CAT-0032,,PureForm,SUP-4B218BE29EF,941.05,285.45,15.051,True,2022-01-31,,SKU-7F92622989D,Politics computer exist throw real next four help blood use ok teacher probably political consider.
PRD-F34F70980FA,NovaWave Robust intangible standardization,CAT-0024,,UrbanEdge,SUP-CFAF083F7BA,1196.02,739.99,44.12,True,2024-09-05,,SKU-55DBE473265,Strong heavy national result very investment enter memory charge know check.
PRD-45F6AD4131E,ZenCraft Networked client-server complexity,CAT-0025,,UrbanEdge,SUP-840C033389A,1431.3,799.23,4.053,True,2023-03-12,,SKU-F773EB1075D,Oil during piece every national a whose whether single entire hundred recent.
PRD-A318170973B,VoltEdge Balanced intermediate challenge,CAT-0018,,PrimeCore,SUP-FD26CBCC4F2,1600.92,872.96,37.172,True,2022-08-26,,SKU-CBF992F7FFA,House character would money own attention against strategy become available your.
PRD-9D5CFAD9297,PrimeCore Versatile uniform encryption,CAT-0008,,AquaFlow,SUP-3B9176F532D,1707.7,636.91,30.925,True,2022-01-31,,SKU-E5A09C23B65,Product would policy clear star daughter imagine discussion little imagine a cost.
PRD-4F4B988DD1D,NorthStar Function-based fresh-thinking open architecture,CAT-0035,,NorthStar,SUP-2A28BC397DF,379.64,116.84,48.619,True,2022-10-02,,SKU-5F9D9CC90FA,Behind forward stop against close trade everything few certain buy best fish all cover eye.
PRD-C118EAAFCBA,EcoVibe Re-contextualized intangible initiative,CAT-0010,,NorthStar,SUP-AB189ADA1EC,879.64,266.78,10.938,True,2021-09-01,,SKU-B506FD0EA01,Like science to use assume middle record organization.
PRD-FDE2B238EC9,VoltEdge Quality-focused responsive analyzer,CAT-0003,,BlueHorizon,SUP-FFAD2C7FE14,999.3,448.24,42.193,True,2024-05-08,2029-09-12,SKU-6E2F1490146,Must traditional able husband street certainly even kitchen including summer bit difficult for continue house.
PRD-12FA5DF3650,TechPulse Fundamental needs-based interface,CAT-0013,,IronBark,SUP-9F7263ADAB4,787.88,407.55,40.881,True,2023-05-20,,SKU-A559AEBDE28,Production pay trip recognize ok recent near find medical note read term force open without sound.
PRD-5DFAD7DDF08,PureForm Decentralized reciprocal challenge,CAT-0029,,UrbanEdge,SUP-8F034B87DDC,1537.45,614.34,49.727,True,2021-10-09,,SKU-12D0FD61F29,Quickly around reach local guess recent high reason goal audience bad radio artist strategy Mrs side.
PRD-12897ED2F15,UrbanEdge Expanded intangible functionalities,CAT-0031,,SwiftLine,SUP-94CC2BE3AD2,192.45,109.0,48.065,True,2025-07-03,,SKU-212A9AE6391,Improve remember call method employee head argue magazine any order.
PRD-0B077B29013,NovaWave Innovative client-driven framework,CAT-0034,,EcoVibe,SUP-9F7263ADAB4,1457.83,871.62,24.113,True,2024-09-25,,SKU-BCB55CC2F5D,Will economic another turn your radio ever total technology party issue improve force job class.
PRD-FE9F6094BD0,EcoVibe Integrated foreground interface,CAT-0016,,AquaFlow,SUP-5FDD8AC74FE,108.91,61.72,16.293,True,2025-07-25,,SKU-169D452F7B7,Majority kitchen Mr ahead late well should who court media part interesting.
PRD-08607BE186A,NorthStar Multi-layered empowering website,CAT-0003,,SilverPeak,SUP-E13A62EDE14,243.7,150.04,23.816,True,2022-09-21,,SKU-9E218CF2A25,Then situation take contain industry red approach how free part director approach reason.
PRD-ED75B7CB69A,EcoVibe Diverse contextually-based capability,CAT-0022,,IronBark,SUP-ACB2C1E8DD3,183.51,66.63,31.294,False,2024-11-07,,SKU-DEB4F5164DD,Charge Congress seven later who long prevent financial care.
PRD-204AB1D2AEF,TechPulse Cloned human-resource algorithm,CAT-0032,,UrbanEdge,SUP-55714A4DB43,1404.15,865.78,49.086,True,2023-01-31,,SKU-8F7B90313C8,Bad exactly work begin treat system spring economy.
PRD-D39FD97F748,UrbanEdge Sharable human-resource approach,CAT-0002,,VoltEdge,SUP-FF6C3B1149A,1612.02,766.5,17.973,True,2025-06-13,,SKU-7DCBE249A30,Set woman address listen might how represent.
PRD-C6770FCB316,PrimeCore De-engineered dedicated artificial intelligence,CAT-0035,,VoltEdge,SUP-3914B10A77C,973.18,462.26,9.57,True,2026-05-29,,SKU-EF143570938,Official think group us today us event care responsibility.
PRD-D073B747D73,ZenCraft Down-sized scalable workforce,CAT-0036,,TechPulse,SUP-40CC3A7B47B,1466.14,601.31,26.604,True,2025-06-06,,SKU-57A23DAC357,Away room try apply more director service long direction generation open history sell.
PRD-C98D918A4C7,PureForm Reactive grid-enabled productivity,CAT-0033,,SwiftLine,SUP-7F0056F2E1E,1085.5,522.81,9.358,False,2021-10-07,,SKU-C92BD48D3AD,Happy enter method finally but newspaper seem me these.
PRD-98547737F31,VoltEdge Versatile encompassing application,CAT-0005,,AquaFlow,SUP-4FBAC18B408,1553.15,614.29,40.971,True,2023-04-24,,SKU-4959C2AE2FF,Put investment figure happen present full certainly.
PRD-413F049ECA0,PrimeCore Compatible bifurcated challenge,CAT-0021,,SwiftLine,SUP-B443FA83AFC,1532.64,554.28,16.169,False,2022-07-01,,SKU-A1998677163,Child require language show pass say with radio per spring.
PRD-F946DC3E558,TechPulse Organic zero-defect infrastructure,CAT-0003,,UrbanEdge,SUP-EB5D39C97B4,92.34,62.34,24.32,False,2021-12-12,,SKU-39112547A02,Drug fall political score majority air test never here college.
PRD-40F4ED3748D,NovaWave Phased heuristic structure,CAT-0017,,NorthStar,SUP-EBACDB7E54B,1673.42,942.42,11.114,True,2021-11-20,2024-01-21,SKU-469FFA81A7E,Pretty article suggest parent hit east among.
PRD-3E75B6F6A0E,ZenCraft Sharable content-based alliance,CAT-0006,,GreenLeaf,SUP-0A7C3BD33C7,1313.22,881.65,3.129,True,2023-02-24,,SKU-A30532509F6,Participant society director rest me certain person director summer thing activity tax tell.
PRD-0A978FF10F4,VoltEdge User-centric bi-directional migration,CAT-0004,,ZenCraft,SUP-A80B2268A5A,834.83,373.69,13.364,False,2025-05-28,2028-02-09,SKU-19D7AD4E1CD,Resource how listen expert toward successful generation common.
PRD-64D412BA61F,NovaWave Synchronized high-level firmware,CAT-0007,,EcoVibe,SUP-A7A31DEFA51,160.48,62.0,11.628,True,2022-10-12,,SKU-6321370A6D9,Into stay decision movement gun at owner design relate need administration.
PRD-B15157EF393,TechPulse Versatile uniform secured line,CAT-0036,,VoltEdge,SUP-3C49978EE67,1315.47,694.58,20.818,True,2024-11-27,,SKU-CECA3704BF1,Drive other chair lead maybe produce them save sound nothing international only.
PRD-1CBC45677DE,AquaFlow Distributed well-modulated solution,CAT-0028,,IronBark,SUP-3B1211E5552,719.14,347.7,8.424,True,2024-01-23,,SKU-6FEE8B8DCBD,Article year fire official car look ever last case heavy already become rock our security high.
PRD-773AA540DDD,SilverPeak Future-proofed clear-thinking database,CAT-0029,,IronBark,SUP-05CA9305BFE,678.34,246.42,45.134,True,2022-10-09,,SKU-AD892C558E8,Possible or clear dog nothing billion wish world process matter hot stage want note work.
PRD-D836C0CFFEF,AquaFlow Profound actuating structure,CAT-0028,,ZenCraft,SUP-A7A31DEFA51,1690.48,785.97,16.24,True,2024-01-28,,SKU-346F972D40B,News deep certainly and bring continue compare able as miss leave here and ahead subject.
PRD-4B2AE348E5C,VoltEdge Realigned systematic matrices,CAT-0017,,BlueHorizon,SUP-713BFCACB32,753.25,391.76,22.43,True,2024-06-19,,SKU-236DAF97903,Business natural stand country himself behavior article right today eye floor during want.
PRD-40519A2914C,NovaWave Versatile actuating toolset,CAT-0009,,IronBark,SUP-F988088B948,1966.0,1058.31,0.428,True,2024-06-06,,SKU-7AB00101BB4,Everybody situation short nearly catch fire impact word first put best about safe yes.
PRD-2F1D3E8CB1F,VoltEdge Versatile impactful contingency,CAT-0018,,IronBark,SUP-8140077879F,633.23,385.39,25.612,True,2023-10-12,,SKU-EB7400E0DB5,Have spring want weight open join avoid.
PRD-A73AA407960,TechPulse Team-oriented 6thgeneration Internet solution,CAT-0009,,PrimeCore,SUP-EBACDB7E54B,193.1,93.49,44.492,True,2021-08-17,,SKU-A0C3A524C2C,Win protect instead begin actually positive trouble federal beautiful bed subject year different.
PRD-DE92541DEE5,SilverPeak Organized needs-based Graphic Interface,CAT-0014,,VoltEdge,SUP-315D7A0570A,604.1,319.08,36.207,True,2022-12-02,,SKU-A978531DEE3,Human stand trouble especially peace among past happen.
PRD-334ABFE0A17,SilverPeak Ergonomic intermediate instruction set,CAT-0007,,SilverPeak,SUP-B443FA83AFC,1652.28,951.45,15.09,True,2024-04-17,,SKU-F1E10705611,Dark network help rise north if home learn address doctor item new today not line.
PRD-13A9352AC2F,PureForm Switchable secondary matrix,CAT-0022,,BlueHorizon,SUP-5FDD8AC74FE,161.56,52.08,20.884,True,2026-06-05,,SKU-7E4D0D51AA5,Authority air sort investment guy such notice to age organization call wall car thing shake grow.
PRD-49CC3250C8C,SilverPeak Self-enabling multi-state orchestration,CAT-0001,,AquaFlow,SUP-7A7F084B66A,457.3,256.6,31.646,False,2025-09-16,,SKU-03099F0737A,Store cost address within network accept want today happy cause authority leave friend fire whatever.
PRD-4A5714F8DD1,BlueHorizon Persevering explicit strategy,CAT-0033,,VoltEdge,SUP-049922408F5,642.04,337.69,7.745,True,2023-10-18,,SKU-C1637A9991A,Provide case father own six benefit pull strong.
PRD-DE3B88C4A5D,SilverPeak Grass-roots background portal,CAT-0033,,EcoVibe,SUP-049922408F5,1942.23,1167.54,21.654,True,2024-03-29,,SKU-93551B9653B,Idea case entire class owner local mention avoid apply religious yet this return hand trouble black.
PRD-55452139396,VoltEdge Synergized explicit hub,CAT-0004,,NovaWave,SUP-F200D5FACB9,675.66,331.3,13.202,True,2024-04-02,,SKU-100C0FC1994,Street animal itself media able official call thank market a off visit anyone place.
PRD-398F8A01A8D,GreenLeaf Triple-buffered global installation,CAT-0036,,UrbanEdge,SUP-AEAD79085A8,1397.25,845.08,19.826,True,2022-08-11,,SKU-72EA65CAB49,Week least deep carry summer like concern clear nice foreign return.
PRD-02BA80CF4C9,UrbanEdge Adaptive analyzing array,CAT-0005,,PrimeCore,SUP-68FE7A5B22B,1994.17,1016.43,21.56,True,2025-05-28,,SKU-C8BB8BD054A,Minute war stage consumer read response drive carry information hope value under some health.
