PRODUCT_ID,PRODUCT_NAME,CATEGORY_ID,SUBCATEGORY,BRAND,SUPPLIER_ID,UNIT_PRICE,UNIT_COST,WEIGHT_KG,IS_ACTIVE,LAUNCH_DATE,DISCONTINUE_DATE,SKU,DESCRIPTION
PRD-4F1A63AA25C,NovaWave Assimilated leadingedge synergy,CAT-0032,,TechPulse,SUP-F242F966961,707.59,251.89,49.517,True,2026-03-12,,SKU-C545D82E40B,Herself land human day herself sport behavior compare tree right.
PRD-7C078021146,ZenCraft Versatile demand-driven capability,CAT-0004,,PureForm,SUP-2A33B87FB9D,1678.94,553.6,20.678,True,2022-02-16,,SKU-252860F02BF,Scientist group yet indeed decision before medical long meet war administration herself information which.
PRD-CDDF4B79E7F,NovaWave Multi-lateral fault-tolerant architecture,CAT-0030,,BlueHorizon,SUP-5F54EA51FAA,1415.8,429.92,30.93,True,2022-01-08,,SKU-D7FA0DAA5C0,Watch present director red practice special then administration who role today animal suggest.
PRD-C853A319B5F,NorthStar Advanced clear-thinking model,CAT-0035,,NovaWave,SUP-CFAF083F7BA,968.99,479.79,0.691,True,2022-05-27,,SKU-42A5414AD9E,Cell like although other decide science fall pay statement.
PRD-D36467E6925,ZenCraft Enhanced multi-state collaboration,CAT-0028,,PureForm,SUP-EA9B50C6582,1955.07,599.93,5.44,False,2023-08-05,,SKU-AC0BD8BF1B5,Half understand skill air daughter idea health success perform.
PRD-8AF07E11034,ZenCraft Assimilated full-range algorithm,CAT-0023,,PrimeCore,SUP-1219E469671,387.9,198.05,4.043,True,2021-09-02,,SKU-D506964D0F1,Alone the trial another help out modern citizen address today begin write both little.
PRD-ECE276CAD70,PrimeCore Public-key leadingedge challenge,CAT-0006,,AquaFlow,SUP-FD26CBCC4F2,490.2,283.77,38.003,False,2026-05-15,,SKU-227A42F540D,Speak a live tonight either follow music whatever protect benefit manage store number call method south.
PRD-12EE31D2CA8,NorthStar Switchable attitude-oriented synergy,CAT-0011,,EcoVibe,SUP-6BCE89892BD,1107.64,357.15,42.282,True,2022-03-26,,SKU-FF1EFF6DB3C,Response executive past economic economy role feeling report.
PRD-D5D53E21CA5,IronBark Reverse-engineered multi-state model,CAT-0034,,IronBark,SUP-958D5AAE392,1954.77,1347.88,11.565,True,2023-10-21,,SKU-7768EC783F6,Write entire tonight foreign hear certainly say surface security son place some woman add play.
PRD-53C2E580827,IronBark Front-line cohesive infrastructure,CAT-0005,,AquaFlow,SUP-F4E1BF1C5A1,1135.73,463.88,44.976,True,2025-08-22,2028-05-27,SKU-1D3CE5EDD4D,Activity lose tax could thank wife if yeah law enjoy key seat.
PRD-FB65E0D6C32,TechPulse Profound global Graphical User Interface,CAT-0026,,IronBark,SUP-315D7A0570A,36.24,13.87,15.034,True,2024-10-02,,SKU-7774788CA38,Effort southern maintain nature professional property garden mind as.
PRD-024E4BB51BF,NovaWave Stand-alone 4thgeneration moratorium,CAT-0022,,SwiftLine,SUP-C82E262A39C,1699.64,970.18,37.013,True,2023-04-30,,SKU-E6ED8C214CC,Behind window store build require call girl laugh network.
PRD-E41AABD8384,BlueHorizon Profit-focused contextually-based infrastructure,CAT-0004,,EcoVibe,SUP-5FDD8AC74FE,161.46,96.58,11.684,False,2026-02-25,,SKU-201BD098AFF,Crime style develop admit safe government over charge teacher modern song guy discover water most.
PRD-006C3358A78,PureForm Cross-platform systemic concept,CAT-0021,,NorthStar,SUP-4D6AB951BF4,1229.66,661.86,13.739,True,2023-05-16,,SKU-94BDBE953C1,Difficult us respond must western interest dark any wide husband hope miss instead live focus return.
PRD-DEA617DAF3C,SwiftLine Compatible eco-centric strategy,CAT-0012,,AquaFlow,SUP-3BD36A168F4,714.84,483.56,33.068,False,2023-01-03,,SKU-C53B94D5E0C,Property decade safe order at sense cell lose civil will with within hospital city industry.
PRD-167D1AB2AE8,EcoVibe Fully-configurable grid-enabled archive,CAT-0018,,TechPulse,SUP-96F4B7D2418,1597.12,934.7,35.613,True,2024-06-09,,SKU-2D58519E62B,White everybody throughout but science want charge kitchen public set.
PRD-1E9B662DBF5,NorthStar Decentralized multi-state function,CAT-0020,,GreenLeaf,SUP-DF351C3CCD4,636.77,218.17,38.091,True,2021-08-01,2024-12-30,SKU-C2B4081DDA4,Bill pick likely produce federal by sea lawyer audience without treat game evening write high.
PRD-E82E236A13D,SwiftLine Customizable responsive Local Area Network,CAT-0007,,NorthStar,SUP-C5922330DA4,900.44,469.94,17.76,False,2025-11-30,,SKU-420396C562D,One then reality some serve different billion young owner out guy thank professor.
PRD-AE1B116A2A9,PrimeCore Optional intangible approach,CAT-0027,,SwiftLine,SUP-7A7F084B66A,652.24,296.18,4.327,True,2025-08-24,,SKU-D016E46B0FE,Tend exactly right every edge meet information student.
PRD-5731028897C,TechPulse Configurable 24/7 attitude,CAT-0025,,TechPulse,SUP-30AFCF024EF,1956.46,1034.55,13.519,True,2026-05-14,,SKU-CF696CAFFB2,Drug manager opportunity program billion sit remain night study heart million understand him own.
PRD-BC58A5A09E3,PrimeCore Stand-alone bandwidth-monitored orchestration,CAT-0031,,PureForm,SUP-315D7A0570A,338.58,138.95,18.12,True,2024-06-07,,SKU-1A020A1EB71,Brother shake guess pull tough instead hour season.
PRD-7C07A6C4247,GreenLeaf Organic logistical orchestration,CAT-0007,,TechPulse,SUP-F988088B948,994.13,543.46,0.438,True,2023-03-29,,SKU-2076A710B25,Also human source season it traditional democratic Congress piece forget factor include agreement lead through.
PRD-DC3E51BB2D8,GreenLeaf Synergized grid-enabled help-desk,CAT-0022,,SwiftLine,SUP-FD26CBCC4F2,762.88,491.97,48.714,True,2023-04-18,,SKU-8C4631C1DCF,Everybody situation foot recognize play shoulder civil next tell possible.
PRD-257F1C91ADC,BlueHorizon Versatile grid-enabled time-frame,CAT-0012,,SwiftLine,SUP-55714A4DB43,1894.82,720.68,14.643,True,2025-03-05,,SKU-3378BCF4544,Suddenly task free pattern science structure dinner stock big.
PRD-CBACA249870,SwiftLine Sharable impactful functionalities,CAT-0018,,ZenCraft,SUP-FD9D5ABF67E,1153.88,458.06,18.314,True,2025-01-30,,SKU-62E51E97CA5,Market control him enter religious go south time senior where follow born ok training record night.
PRD-BA3D9837909,PureForm Public-key context-sensitive infrastructure,CAT-0036,,NorthStar,SUP-49910D6AB48,1994.54,741.91,23.135,True,2025-04-02,,SKU-498FC8100F9,Receive cup bed our theory identify enjoy respond mouth however TV billion what sport thought family.
PRD-0AE222D17FD,ZenCraft Configurable fresh-thinking definition,CAT-0027,,AquaFlow,SUP-6BCE89892BD,586.21,338.32,7.045,True,2024-05-02,,SKU-01EEE269EEF,Step early choice yeah ago difference reason despite themselves key specific certainly father.
PRD-EBAE456EDFF,SwiftLine Seamless mission-critical intranet,CAT-0005,,GreenLeaf,SUP-CE955921D2A,312.52,146.65,24.014,True,2026-04-11,,SKU-570D29278E5,News your court control million hundred offer total hit end someone hair soon.
PRD-0B30891BE52,NovaWave Multi-lateral disintermediate functionalities,CAT-0003,,PureForm,SUP-DF351C3CCD4,1841.18,1061.78,35.112,True,2023-08-27,,SKU-182F6987BDD,Ground when care team worry east Mrs can wonder six medical little finish southern page.
PRD-B4E1508C33A,UrbanEdge Universal tangible project,CAT-0023,,TechPulse,SUP-D410FCFC211,1829.23,628.79,30.673,True,2025-01-27,,SKU-C761EF5A6B4,Start difference especially student least just opportunity ask yet against large practice time live relationship.
PRD-8C2A14B05CC,BlueHorizon Multi-channeled asymmetric success,CAT-0028,,EcoVibe,SUP-BF95D07074B,1295.25,889.48,5.02,True,2021-11-04,,SKU-A5E83AB9741,Now water road require make region wall worry Democrat laugh Mrs.
PRD-2DB7DAC98F3,UrbanEdge Managed discrete open system,CAT-0029,,BlueHorizon,SUP-FD9D5ABF67E,1118.2,643.04,23.207,True,2024-11-06,,SKU-F61A2E76AA1,Watch certain much race fire according participant Republican group build within pass morning room run.
PRD-C27344F409B,GreenLeaf Right-sized zero-defect task-force,CAT-0007,,PrimeCore,SUP-BC7E1D9889C,305.74,213.74,46.035,False,2022-10-03,,SKU-FAD9A9ABD23,Structure ahead up rock forward behind idea red rate.
PRD-D45B97078D3,BlueHorizon Multi-tiered tangible leverage,CAT-0030,,PureForm,SUP-FDF87FA49F0,1461.65,642.15,26.104,True,2025-06-28,2030-07-15,SKU-173A4817706,Suggest consumer find concern involve edge before employee customer.
PRD-B88F5234D5E,PrimeCore Stand-alone scalable artificial intelligence,CAT-0003,,PureForm,SUP-E6661451775,1395.04,596.47,5.843,True,2023-04-05,,SKU-164B0BD7B5F,Later behind election these article news radio believe ability world actually force.
PRD-0CC099D8B46,VoltEdge Re-contextualized non-volatile hub,CAT-0016,,NovaWave,SUP-FF9492EFD56,1355.89,495.91,27.64,True,2023-01-14,,SKU-DC6187A7113,Western country per consider despite generation the tree.
PRD-FB766BF1E9D,AquaFlow Re-engineered context-sensitive intranet,CAT-0012,,TechPulse,SUP-0A7C3BD33C7,926.8,573.78,32.9,True,2024-06-24,,SKU-62ED2A6FB7E,Medical sport knowledge performance very thousand soldier build various.
PRD-20D1B53B6F0,SwiftLine Customer-focused grid-enabled software,CAT-0025,,NorthStar,SUP-66DAE64C68F,1766.78,847.75,10.818,True,2026-02-17,,SKU-C09F1BA4CD5,Operation cold between cover choice party front lawyer probably.
PRD-FFA4BCE6413,PureForm Organized bifurcated secured line,CAT-0035,,TechPulse,SUP-EBACDB7E54B,1593.04,845.81,16.367,True,2025-08-15,,SKU-F26EEC7DEC2,Assume east center whether make some among around word lose such process senior opportunity summer.
PRD-14F6346E827,AquaFlow Streamlined fresh-thinking moderator,CAT-0021,,SilverPeak,SUP-4DAB28C9C9A,1725.96,882.11,30.604,True,2021-12-23,,SKU-ED2C44EC02E,Offer mother hour national cut fly language cup want international itself bank agency bit night.
PRD-8AEB1D1A5AF,ZenCraft Integrated modular toolset,CAT-0020,,IronBark,SUP-A80B2268A5A,1691.81,925.33,29.549,True,2024-07-12,,SKU-B7E47481EC2,Side recognize month among water film onto too myself political school.
PRD-84852FE8660,BlueHorizon Business-focused exuding info-mediaries,CAT-0010,,NovaWave,SUP-4DAB28C9C9A,480.95,166.78,20.97,True,2024-02-28,,SKU-4B026D58890,Goal Mrs statement range its meet support meet race and.
PRD-307B15309A9,VoltEdge Persevering contextually-based definition,CAT-0012,,NovaWave,SUP-816E142D7E4,375.58,208.15,24.533,True,2022-08-02,,SKU-ACCF01748B5,Authority data deal policy administration two deal ready under above drive sport.
PRD-1AC508E0955,BlueHorizon Enhanced human-resource emulation,CAT-0001,,GreenLeaf,SUP-AE6A471A57B,904.75,290.83,9.837,True,2025-08-14,,SKU-DCA799C64D5,True I choose out perform election two quite report top finally wait.
PRD-6FB252A95DC,GreenLeaf Future-proofed incremental solution,CAT-0027,,VoltEdge,SUP-DBE38ABF1D3,1307.87,606.4,24.486,False,2024-09-29,2030-01-04,SKU-2407D7C92AF,Indeed including everything too stage major outside.
PRD-B7C0BC90071,UrbanEdge Object-based 6thgeneration standardization,CAT-0035,,PrimeCore,SUP-5EB43F3C4B2,444.96,139.31,39.059,True,2024-08-11,,SKU-9C8CFB34B7F,Can ready audience boy city social at Mr cold science western resource reason expect.
PRD-83E6F337451,SilverPeak Re-contextualized empowering benchmark,CAT-0008,,PrimeCore,SUP-68FE7A5B22B,993.15,500.87,27.201,True,2022-12-09,,SKU-2541196BA6B,House those dark beat suffer customer million along long.
PRD-2472C5350EC,GreenLeaf Automated human-resource contingency,CAT-0035,,UrbanEdge,SUP-957082F21D6,1514.79,914.94,5.211,True,2022-01-29,,SKU-610BFAE5736,Several southern drop past just central others American.
PRD-4C23614D34B,GreenLeaf Visionary content-based throughput,CAT-0017,,BlueHorizon,SUP-C5922330DA4,598.93,419.09,22.01,True,2026-02-14,,SKU-AC413708C64,Right analysis add check teacher economy compare left top argue.
PRD-C81DDC6B0BD,SilverPeak Implemented motivating architecture,CAT-0023,,ZenCraft,SUP-E6661451775,477.71,298.23,30.552,True,2023-05-26,,SKU-79510F46207,Contain create price keep the attorney early more news century.
PRD-B276BAA8089,PureForm Centralized bifurcated software,CAT-0004,,SilverPeak,SUP-686310CF26D,1570.77,982.38,26.661,True,2026-04-10,,SKU-9C6A31750B2,Improve move peace college usually have century billion.
PRD-DBED3F592B8,SilverPeak Multi-tiered 24hour open system,CAT-0018,,ZenCraft,SUP-F280D9BC138,1958.11,816.64,49.276,True,2022-09-05,2027-11-19,SKU-9CC6BF06D25,Sport shoulder build different pick nor available power.
PRD-A97DD11AE67,PrimeCore Re-engineered secondary info-mediaries,CAT-0009,,VoltEdge,SUP-81B1C7515D1,1572.45,1049.62,12.559,True,2026-01-04,,SKU-30905806906,Rate hit travel down make economic woman PM look together lawyer.
PRD-1ECD30EA6D0,GreenLeaf Face-to-face client-server forecast,CAT-0010,,SilverPeak,SUP-58EE1E07127,1524.14,869.51,13.509,True,2025-11-09,,SKU-6B710D82FD2,White home either civil science it feel amount improve.
PRD-0CEC386E4AA,EcoVibe Focused impactful capacity,CAT-0026,,NovaWave,SUP-F9C75856D9B,1269.09,827.51,13.983,True,2025-11-10,,SKU-8F6D685D46F,Good walk inside individual safe know home hair for human rich day describe course create them.
PRD-0D2BCC7C8DE,NorthStar Secured high-level Local Area Network,CAT-0006,,VoltEdge,SUP-3C46B338EE5,1900.76,819.07,31.779,True,2024-10-09,,SKU-C7B182A5DB0,Television society hear fill hotel like myself laugh toward what thank include current front three.
PRD-E4DCB85BEFF,SwiftLine Programmable intermediate contingency,CAT-0014,,GreenLeaf,SUP-D6D36B5599A,1592.38,731.04,16.211,True,2024-10-10,,SKU-BD85CFC8E3E,Agency deal note common worker quite shoulder political offer song character first early.
PRD-E26B00F44CE,PureForm Virtual mobile functionalities,CAT-0022,,IronBark,SUP-94CC2BE3AD2,265.54,170.2,38.136,False,2025-03-01,,SKU-F383D6888E5,Usually partner same then put skin beat across television apply system finish top data character defense.
PRD-55355D81D9C,IronBark Multi-lateral regional functionalities,CAT-0011,,GreenLeaf,SUP-3B9176F532D,1674.22,513.17,0.134,True,2025-08-31,,SKU-5F491ABC002,Toward land full compare field sort civil thing clear budget travel important no pick record example.
PRD-8DD2FAD2188,AquaFlow Fully-configurable bifurcated protocol,CAT-0020,,TechPulse,SUP-EE055397C6D,1378.74,486.37,4.758,True,2025-09-13,2030-06-04,SKU-762BEAB474E,Training best always they list local short only write.
PRD-FE2A6D2F10D,SwiftLine Organic optimal orchestration,CAT-0020,,VoltEdge,SUP-371E01CD40B,1808.08,662.14,37.786,True,2023-04-25,2024-11-04,SKU-8A64BC4039A,Language after man public gas fund be have concern.
PRD-2E79848B928,TechPulse Synergistic hybrid collaboration,CAT-0015,,NovaWave,SUP-94CC2BE3AD2,7.17,3.52,22.309,False,2024-08-07,,SKU-83A2EFB8453,Year social protect which fly represent we bar.
PRD-8E53D072877,VoltEdge Proactive 3rdgeneration process improvement,CAT-0009,,GreenLeaf,SUP-527D4D73F2A,245.58,158.19,11.524,False,2024-06-30,,SKU-1270E017C39,Individual college surface court exactly minute trouble majority town appear draw fill large item American seek.
PRD-096D1066F4C,PrimeCore Persevering stable artificial intelligence,CAT-0009,,SwiftLine,SUP-68FE7A5B22B,210.89,94.27,40.687,True,2025-04-08,,SKU-C6F377CE523,Necessary candidate within person same affect herself toward here along public recent.
PRD-2AEBDD7447A,SilverPeak Profound zero tolerance interface,CAT-0001,,SilverPeak,SUP-FD26CBCC4F2,1355.89,443.87,8.289,True,2023-03-08,,SKU-0D658164E11,Religious car get energy cover example bar last public south tree technology time.
PRD-E2674DC87C5,SilverPeak De-engineered well-modulated benchmark,CAT-0029,,ZenCraft,SUP-854E6DADA98,1497.8,1000.47,4.426,True,2021-08-23,,SKU-60F6FD729F0,Avoid health child soon single tell act add southern thank.
PRD-898223A38F2,SwiftLine Distributed optimal product,CAT-0021,,PureForm,SUP-30AFCF024EF,1181.2,535.81,12.465,True,2024-07-26,,SKU-2A9AD19EC55,Piece former professor partner argue catch truth unit control responsibility before item rate decision.
PRD-1BB48FEC653,PrimeCore Networked fresh-thinking product,CAT-0002,,ZenCraft,SUP-8FEB009A2AD,1203.99,708.51,43.804,True,2025-01-21,,SKU-9F29E23254C,Cover stage remain manager relationship light rule option team kind medical bag wind enjoy there.
PRD-43D70343492,AquaFlow Ergonomic tangible capability,CAT-0004,,PureForm,SUP-44E855D1237,381.35,174.16,24.795,True,2024-05-12,,SKU-7AD60D1D860,Could support series direction house structure father include.
PRD-95A1ED92BFA,NorthStar Extended interactive extranet,CAT-0024,,IronBark,SUP-55714A4DB43,1189.89,608.41,6.686,True,2024-09-06,,SKU-40A562D9533,Save most pressure why edge senior ask artist general run people stage.
PRD-F7C5373F9E8,PureForm Virtual transitional knowledge user,CAT-0031,,PureForm,SUP-527D4D73F2A,734.0,420.71,0.933,False,2021-12-03,,SKU-56F7ECF1263,With purpose five sign trial recently painting.
PRD-B77B4126007,PureForm Re-contextualized empowering superstructure,CAT-0026,,NovaWave,SUP-E33589322D9,84.45,27.38,31.466,True,2026-04-01,,SKU-D30CAA2F698,Late score lose matter shake finish yourself couple onto amount good let.
PRD-5CAE8275BD2,NovaWave Open-architected maximized Local Area Network,CAT-0035,,SilverPeak,SUP-6AD9C1479AA,1405.11,467.86,13.946,True,2023-10-20,,SKU-25B5E4E73F9,Check scene history wear them small high that change hand its stage town character.
PRD-11427521897,NovaWave Extended bandwidth-monitored adapter,CAT-0021,,SwiftLine,SUP-09E0A497813,410.38,255.76,31.751,True,2026-03-09,,SKU-11AA7842ABC,Line even cup market citizen stop take everyone couple parent material itself surface.
PRD-C09D44D22D9,VoltEdge Synchronized analyzing help-desk,CAT-0016,,NorthStar,SUP-A58BB3FCED3,136.9,79.33,4.402,True,2023-12-05,,SKU-C7BB0A9CF4F,At follow live eye dog wall sound indicate.
PRD-562C3B0BC59,VoltEdge Integrated responsive complexity,CAT-0012,,EcoVibe,SUP-B577E9D6CD7,1219.62,516.77,35.424,True,2021-08-05,,SKU-45FA0A3F722,Piece range investment business can example right southern ten hard wife as.
PRD-8C21F9441FF,PureForm Operative dynamic database,CAT-0017,,TechPulse,SUP-2A3A6928661,1906.27,970.68,6.434,True,2023-09-24,,SKU-6D6DF46D404,Read travel total plant top live exactly future soldier recognize top whole.
PRD-F6727CFAC1B,NorthStar Re-engineered discrete strategy,CAT-0022,,PureForm,SUP-D82E6D26EDF,1773.4,1079.24,13.672,False,2025-05-17,,SKU-017BD3F18D8,Participant spend eat none three finish thing his chance focus more leg too water road at.
PRD-7050CFA1C8A,GreenLeaf Ergonomic zero administration focus group,CAT-0033,,BlueHorizon,SUP-7A4AA93387F,1155.42,382.25,25.031,True,2023-06-13,,SKU-BD70527442C,Hair sing listen development able green per no situation.
PRD-F2A372C6EFE,SilverPeak Pre-emptive foreground portal,CAT-0008,,UrbanEdge,SUP-16C6552F9F1,513.96,175.34,25.49,False,2026-03-28,,SKU-91663906E5A,Customer specific could type painting fast art those model mean eat heavy red system fear.
PRD-C64140395F8,SwiftLine Implemented 4thgeneration algorithm,CAT-0010,,TechPulse,SUP-0E61F335D23,492.88,240.87,27.688,True,2022-07-15,,SKU-6DA8D380A63,Bad let travel challenge personal new order serve blue event every relationship law.
PRD-66771557382,SwiftLine De-engineered fresh-thinking adapter,CAT-0021,,PrimeCore,SUP-315D7A0570A,841.64,360.83,28.62,True,2022-05-01,,SKU-63171DE4140,Appear force local center story heart agent its food.
PRD-D29517466C6,NovaWave Seamless well-modulated alliance,CAT-0003,,SwiftLine,SUP-40CC3A7B47B,110.08,42.85,43.862,True,2022-05-28,,SKU-5D7AB16A614,Food series always memory reveal require market until cause bill clear.
PRD-374F8B048D8,GreenLeaf Cross-group web-enabled hierarchy,CAT-0001,,BlueHorizon,SUP-F917A1B15E2,624.84,209.04,14.651,True,2025-01-15,,SKU-94320655873,Full include seem manage nation modern politics how choice state sport large.
PRD-8A97AB05A1F,GreenLeaf Fundamental discrete encoding,CAT-0013,,VoltEdge,SUP-D8FF575902A,488.96,218.72,38.048,True,2022-02-05,2025-05-24,SKU-9C6DE2139B0,Population newspaper appear successful different amount despite discussion.
PRD-A18461BA8BE,AquaFlow Devolved motivating functionalities,CAT-0001,,BlueHorizon,SUP-06E8F4C3A9F,52.7,27.23,37.971,True,2022-04-13,,SKU-43785BEE526,Hold plant how member face age resource increase attack customer along director.
PRD-348732ACB2F,UrbanEdge Monitored tangible artificial intelligence,CAT-0027,,GreenLeaf,SUP-5F54EA51FAA,618.48,236.31,48.631,True,2023-12-13,,SKU-BED5EB56161,Think meeting stock however charge account physical performance enter hear home strong senior eight cultural today.
PRD-E3C5F200D6A,ZenCraft Streamlined executive knowledge user,CAT-0034,,SwiftLine,SUP-371E01CD40B,92.58,36.35,44.789,True,2023-06-18,,SKU-6AD969B62A9,Knowledge whose public show daughter both hold.
PRD-9859019C760,AquaFlow Expanded dedicated task-force,CAT-0026,,EcoVibe,SUP-2FD8B370625,1163.64,584.35,28.434,True,2022-01-20,,SKU-7119D51AF3A,Save fear ready Democrat order field less possible discover three such describe agency actually stop.
PRD-A8AE6B5505F,BlueHorizon Expanded modular success,CAT-0026,,VoltEdge,SUP-8F034B87DDC,477.36,193.04,16.38,True,2025-10-06,,SKU-9A35D0FA075,Result leader hospital send TV lose others some project visit back blue a.
PRD-D0007AE712D,PureForm Business-focused 24/7 focus group,CAT-0007,,TechPulse,SUP-EB5D39C97B4,1887.39,668.98,8.302,True,2021-09-07,,SKU-92667118B67,Field high nothing city apply democratic course.
PRD-C2D3AE7A552,UrbanEdge Multi-layered asynchronous focus group,CAT-0029,,PrimeCore,SUP-D7AB0FBA4B7,1074.17,736.72,13.324,True,2023-08-12,,SKU-C908EB8F9DD,President father alone build center lead usually work trip build PM weight society.
PRD-98DEC6F2072,VoltEdge Phased context-sensitive access,CAT-0003,,UrbanEdge,SUP-318DD7CACE2,1373.68,866.18,7.501,True,2025-11-10,,SKU-4704269BAA3,Beat doctor thank often newspaper establish reflect look.
PRD-F28B7F287F4,PrimeCore Distributed didactic architecture,CAT-0017,,ZenCraft,SUP-FF9492EFD56,795.51,254.23,1.651,True,2025-02-16,,SKU-A91D610DE96,Question air market store include win officer analysis as show exactly example look.
PRD-F0A09A164AC,GreenLeaf Assimilated static flexibility,CAT-0007,,PureForm,SUP-30AFCF024EF,1497.42,598.88,6.161,False,2025-06-23,,SKU-3C6BEFA2E18,Dog language ability practice them structure itself weight major discuss.
PRD-A998EF53744,SwiftLine Business-focused executive hierarchy,CAT-0024,,AquaFlow,SUP-58EE1E07127,448.46,170.08,46.885,False,2025-09-14,,SKU-58434638C5D,Our lead line clearly probably he necessary certainly.
PRD-A87B678E802,EcoVibe Monitored incremental conglomeration,CAT-0013,,IronBark,SUP-D410FCFC211,1835.27,605.63,22.227,True,2025-02-23,,SKU-2DAE6719721,I level girl factor sport seem manager my growth it own those four grow level send.
PRD-54DB6965FBE,NorthStar Down-sized 6thgeneration Graphical User Interface,CAT-0030,,NorthStar,SUP-5EB43F3C4B2,1659.57,717.96,46.214,True,2025-10-08,,SKU-B978223C703,Truth work certain game plan seat surface off with society station how statement thing.
PRD-F09C77CE7A7,SwiftLine Quality-focused 6thgeneration model,CAT-0012,,BlueHorizon,SUP-CADD8E95F2C,994.77,450.72,45.424,True,2026-05-27,,SKU-5DA7E4F6135,Offer effort nearly walk science range skin major.
PRD-841E82AC7AC,SilverPeak Multi-layered neutral infrastructure,CAT-0016,,AquaFlow,SUP-4D26F13A1EB,301.52,164.52,24.995,True,2023-02-17,,SKU-5B3025CB609,Prevent hotel officer seek reach write difficult popular choose really send respond throw wide son.
PRD-CCFA04FAB70,SwiftLine Compatible system-worthy function,CAT-0013,,AquaFlow,SUP-B7CD518070E,180.0,81.58,12.532,True,2023-12-19,,SKU-2017842769D,Sense field decide point week course administration fast debate still.
PRD-0EB0F8592B0,VoltEdge Cloned eco-centric knowledge user,CAT-0023,,GreenLeaf,SUP-D8FF575902A,43.96,19.91,39.094,True,2024-11-16,,SKU-D846D8E912F,Instead group idea recently feel hold decade investment operation.
PRD-249DB527A4B,NorthStar Seamless optimizing analyzer,CAT-0021,,SilverPeak,SUP-049922408F5,646.6,263.93,1.562,True,2023-11-19,,SKU-74376552B8D,With matter goal eight list something send show institution onto thing we range yes.
PRD-4921FE52013,BlueHorizon Pre-emptive well-modulated array,CAT-0015,,TechPulse,SUP-332689FE88F,1618.26,790.8,12.468,True,2023-05-26,,SKU-DFA66488680,Edge begin early store piece behind here front page light follow need region later.
PRD-191244D40F9,PureForm Cross-platform 24/7 software,CAT-0015,,SilverPeak,SUP-4DAB28C9C9A,1583.52,941.92,17.805,True,2024-07-19,,SKU-C3555EB1C84,Order push agreement media attorney Congress ever north soon.
PRD-F7E7D61BF96,PureForm Up-sized actuating extranet,CAT-0023,,IronBark,SUP-2FD8B370625,356.32,191.35,1.508,True,2024-03-01,,SKU-AEF0BC12EC2,Brother might community later table always over interview rather why baby lot eat hold season president.
PRD-4F59AE41DD2,UrbanEdge Multi-tiered 6thgeneration framework,CAT-0032,,NovaWave,SUP-59B14753160,1129.39,593.2,8.86,False,2022-05-26,2026-10-09,SKU-8B59823CC2D,Development tend on management research space way break clearly.
PRD-3B9E312A81C,NorthStar Robust non-volatile algorithm,CAT-0022,,IronBark,SUP-A80B2268A5A,441.52,225.43,10.153,True,2022-03-07,,SKU-24ED619F872,Many some involve remain today happy myself industry almost job reduce at beautiful.
PRD-54900BD2405,BlueHorizon Synchronized heuristic leverage,CAT-0004,,NorthStar,SUP-EB5D2A674AD,1837.97,1172.1,29.372,True,2025-11-06,,SKU-57CB3895477,Medical during until case agency beat cost cultural process national newspaper long wife.
PRD-9FA9CC46E14,EcoVibe Reduced incremental budgetary management,CAT-0024,,VoltEdge,SUP-996D2D71228,1693.73,1091.22,19.84,True,2024-10-04,,SKU-64F2E36CF0F,Always dark feel second hospital head member activity modern entire most field specific floor during.
PRD-EA8815CAD16,SwiftLine Extended content-based protocol,CAT-0032,,AquaFlow,SUP-55714A4DB43,277.22,100.63,8.793,True,2023-11-23,,SKU-3B5E9682E01,Long degree common need phone teach audience project tax certainly set local wrong authority.
